<?xml version="1.0" encoding="UTF-8"?><Configuration xmlns:xsi="http://www.w3.org/2001/XMLSchema-instance" xsi:noNamespaceSchemaLocation="schema/mefa.xsd">    <StandardizationConfig module-name="Standardization" parser-class="com.sun.mdm.index.configurator.impl.standardization.StandardizationConfiguration">        <standardize-system-object>            <system-object-name>AUSPatient</system-object-name>            <structures-to-normalize>                <group standardization-type="PersonName" domain-selector="com.sun.mdm.index.matching.impl.MultiDomainSelector">                    <locale-field-name></locale-field-name>                    <locale-maps>                        <locale-codes>                            <value>Default</value>                            <locale>US</locale>                        </locale-codes>                    </locale-maps>                    <unnormalized-source-fields>                        <source-mapping>                            <unnormalized-source-field-name>AUSPatient.FirstName</unnormalized-source-field-name>                            <standardized-object-field-id>FirstName</standardized-object-field-id>                        </source-mapping>                    </unnormalized-source-fields>                    <normalization-targets>                        <target-mapping>                            <standardized-object-field-id>FirstName</standardized-object-field-id>                            <standardized-target-field-name>AUSPatient.FirstName_Std</standardized-target-field-name>                        </target-mapping>                    </normalization-targets>                </group>                <group standardization-type="PersonName" domain-selector="com.sun.mdm.index.matching.impl.MultiDomainSelector">                    <locale-field-name></locale-field-name>                    <locale-maps>                        <locale-codes>                            <value>Default</value>                            <locale>US</locale>                        </locale-codes>                    </locale-maps>                    <unnormalized-source-fields>                        <source-mapping>                            <unnormalized-source-field-name>AUSPatient.LastName</unnormalized-source-field-name>                            <standardized-object-field-id>LastName</standardized-object-field-id>                        </source-mapping>                    </unnormalized-source-fields>                    <normalization-targets>                        <target-mapping>                            <standardized-object-field-id>LastName</standardized-object-field-id>                            <standardized-target-field-name>AUSPatient.LastName_Std</standardized-target-field-name>                        </target-mapping>                    </normalization-targets>                </group>            </structures-to-normalize>            <free-form-texts-to-standardize>                <group standardization-type="Address" domain-selector="com.sun.mdm.index.matching.impl.MultiDomainSelector">                    <locale-field-name></locale-field-name>                    <locale-maps>                        <locale-codes>                            <value>Default</value>                            <locale>US</locale>                        </locale-codes>                    </locale-maps>                    <unstandardized-source-fields>                        <unstandardized-source-field-name>AUSPatient.Address[*].AddressLine1</unstandardized-source-field-name>                    </unstandardized-source-fields>                    <standardization-targets>                        <target-mapping>                            <standardized-object-field-id>HouseNumber</standardized-object-field-id>                            <standardized-target-field-name>AUSPatient.Address[*].AddressLine1_HouseNo</standardized-target-field-name>                        </target-mapping>                        <target-mapping>                            <standardized-object-field-id>RuralRouteIdentif</standardized-object-field-id>                            <standardized-target-field-name>AUSPatient.Address[*].AddressLine1_HouseNo</standardized-target-field-name>                        </target-mapping>                        <target-mapping>                            <standardized-object-field-id>BoxIdentif</standardized-object-field-id>                            <standardized-target-field-name>AUSPatient.Address[*].AddressLine1_HouseNo</standardized-target-field-name>                        </target-mapping>                        <target-mapping>                            <standardized-object-field-id>MatchStreetName</standardized-object-field-id>                            <standardized-target-field-name>AUSPatient.Address[*].AddressLine1_StName</standardized-target-field-name>                        </target-mapping>                        <target-mapping>                            <standardized-object-field-id>RuralRouteDescript</standardized-object-field-id>                            <standardized-target-field-name>AUSPatient.Address[*].AddressLine1_StName</standardized-target-field-name>                        </target-mapping>                        <target-mapping>                            <standardized-object-field-id>BoxDescript</standardized-object-field-id>                            <standardized-target-field-name>AUSPatient.Address[*].AddressLine1_StName</standardized-target-field-name>                        </target-mapping>                        <target-mapping>                            <standardized-object-field-id>PropDesPrefDirection</standardized-object-field-id>                            <standardized-target-field-name>AUSPatient.Address[*].AddressLine1_StDir</standardized-target-field-name>                        </target-mapping>                        <target-mapping>                            <standardized-object-field-id>PropDesSufDirection</standardized-object-field-id>                            <standardized-target-field-name>AUSPatient.Address[*].AddressLine1_StDir</standardized-target-field-name>                        </target-mapping>                        <target-mapping>                            <standardized-object-field-id>StreetNamePrefDirection</standardized-object-field-id>                            <standardized-target-field-name>AUSPatient.Address[*].AddressLine1_StDir</standardized-target-field-name>                        </target-mapping>                        <target-mapping>                            <standardized-object-field-id>StreetNameSufDirection</standardized-object-field-id>                            <standardized-target-field-name>AUSPatient.Address[*].AddressLine1_StDir</standardized-target-field-name>                        </target-mapping>                        <target-mapping>                            <standardized-object-field-id>StreetNameSufType</standardized-object-field-id>                            <standardized-target-field-name>AUSPatient.Address[*].AddressLine1_StType</standardized-target-field-name>                        </target-mapping>                        <target-mapping>                            <standardized-object-field-id>StreetNamePrefType</standardized-object-field-id>                            <standardized-target-field-name>AUSPatient.Address[*].AddressLine1_StType</standardized-target-field-name>                        </target-mapping>                        <target-mapping>                            <standardized-object-field-id>PropDesSufType</standardized-object-field-id>                            <standardized-target-field-name>AUSPatient.Address[*].AddressLine1_StType</standardized-target-field-name>                        </target-mapping>                        <target-mapping>                            <standardized-object-field-id>PropDesPrefType</standardized-object-field-id>                            <standardized-target-field-name>AUSPatient.Address[*].AddressLine1_StType</standardized-target-field-name>                        </target-mapping>                    </standardization-targets>                </group>            </free-form-texts-to-standardize>            <phoneticize-fields>                <phoneticize-field>                    <unphoneticized-source-field-name>AUSPatient.FirstName_Std</unphoneticized-source-field-name>                    <phoneticized-target-field-name>AUSPatient.FirstName_Phon</phoneticized-target-field-name>                    <encoding-type>Soundex</encoding-type>                </phoneticize-field>                <phoneticize-field>                    <unphoneticized-source-field-name>AUSPatient.LastName_Std</unphoneticized-source-field-name>                    <phoneticized-target-field-name>AUSPatient.LastName_Phon</phoneticized-target-field-name>                    <encoding-type>NYSIIS</encoding-type>                </phoneticize-field>                <phoneticize-field>                    <unphoneticized-source-field-name>AUSPatient.Address[*].AddressLine1_StName</unphoneticized-source-field-name>                    <phoneticized-target-field-name>AUSPatient.Address[*].AddressLine1_StPhon</phoneticized-target-field-name>                    <encoding-type>NYSIIS</encoding-type>                </phoneticize-field>            </phoneticize-fields>        </standardize-system-object>    </StandardizationConfig>    <MatchingConfig module-name="Matching" parser-class="com.sun.mdm.index.configurator.impl.matching.MatchingConfiguration">        <match-system-object>            <object-name>AUSPatient</object-name>            <match-columns>                <match-column>                    <column-name>Enterprise.SystemSBR.AUSPatient.FirstName_Std</column-name>                    <mat